{"envelope_path":"snapshots/00000000000000000001.envelope.json","fetch_contract":{"envelope_max_bytes":16384,"forward_credentials_on_redirect":false,"https_required":true,"latest_max_bytes":16384,"max_redirects":2,"retry_attempts":3,"same_origin_redirects_only":true,"snapshot_max_bytes":4194304},"pointer_schema_version":1,"sequence":1,"snapshot_path":"snapshots/00000000000000000001.json","snapshot_schema_version":1}
